1; MARQUISE: Marquise obrigatória de 2,00m no pavimento de acesso de pedestre, respeitado o disposto no art. 24, § 4º.
2;" UOS: Tipo A - CNM 1 Bl A a H; CNN 1 BL A,C,D,E,F,G e H; CNM 2 Lt B e CNN 2 Lt B."
3; TX OCUP, CFA B e CFA M:  Taxa de ocupação e coeficiente de aproveitamento excluem a cobertura.
4; ALT MAX: Altura máxima inclui a cobertura.
5;" UOS: Tipo A - QNM 15 Lt G PLL; QNN 15 Lt G PLL; QNM 16 Lt G PLL; QNN 16 Lt G PLL."
6;(3) TX OCUP, CFA B e CFA M:  Taxa de ocupação e coeficiente de aproveitamento excluem a cobertura.      (4) ALT MAX: Altura máxima inclui a cobertura.
7;"(4) ALT MAX: Altura máxima inclui a cobertura.       (5) UOS: Tipo A - QNM 15 Lt G PLL; QNN 15 Lt G PLL; QNM 16 Lt G PLL; QNN 16 Lt G PLL."
